{
  "schema":"fde-agent/data-quality-profile/v1","profile_id":"profile-ap-events-ready","tenant_ref":"tenant-demo","task_id":"ap-invoice-po-exception","source_subject":{"source_id":"source-ap-events","digest":"aaaaaaaaaaaaaaaaaaaaaaaaaaaaaaaaaaaaaaaaaaaaaaaaaaaaaaaaaaaaaaaa","schema_version":"v1"},"evaluated_at":"2026-08-16T16:00:00Z","fields":[{"field_path":"invoice_id","critical":true,"completeness":1,"validity":1,"uniqueness":1,"consistency":1,"observed_age_seconds":30,"status":"PASS","issue_codes":[]},{"field_path":"purchase_order_id","critical":true,"completeness":1,"validity":1,"uniqueness":1,"consistency":1,"observed_age_seconds":30,"status":"PASS","issue_codes":[]},{"field_path":"resolved_at","critical":true,"completeness":1,"validity":1,"uniqueness":0.99,"consistency":1,"observed_age_seconds":30,"status":"PASS","issue_codes":[]},{"field_path":"notes","critical":false,"completeness":0.9,"validity":0.95,"uniqueness":0.8,"consistency":0.95,"observed_age_seconds":30,"status":"DEGRADED","issue_codes":["OPTIONAL_NOTES_MISSING"]}],"declared_overall_state":"DEGRADED"
}
